article,highlights
"The United States is the third most populous country in the world, with over 330 million people. It is a diverse country, with a wide range of ethnic and cultural backgrounds. The most populous state in the US is California, with over 39 million people.","The United States is the third most populous country in the world."
"The Amazon rainforest is the largest tropical rainforest in the world, covering an area of over 6 million square kilometers. It is home to a vast array of plant and animal species, many of which are found nowhere else on Earth. The rainforest is also a vital carbon sink, helping to regulate the Earth's climate.","The Amazon rainforest is the largest tropical rainforest in the world."
"Water covers over 70% of the Earth's surface, with the majority of it being in the form of saltwater. Freshwater, which is essential for human and animal life, makes up less than 3% of the Earth's total water supply. The largest freshwater lake in the world is Lake Superior, located in North America.","Water covers over 70% of the Earth's surface."
"The European Union is a political and economic union of 27 member states located primarily in Europe. It was formed in the aftermath of World War II with the aim of promoting peace and economic prosperity among its members. The euro is the official currency of 19 of the member states.","The European Union is a political and economic union of 27 member states."
"China is the most populous country in the world, with over 1.4 billion people. It is also the second-largest economy in the world, after the United States. The capital of China is Beijing, and the official language is Mandarin.","China is the most populous country in the world."
"The human brain is the most complex organ in the body, consisting of over 100 billion neurons and trillions of connections between them. It controls everything we do, from our thoughts and emotions to our movements and senses. The brain is divided into different regions that are responsible for different functions.","The human brain is the most complex organ in the body."
"The Great Barrier Reef is the largest coral reef system in the world, stretching over 2,300 kilometers along the coast of Australia. It is home to thousands of species of marine life, including sea turtles, dolphins, and sharks. The reef is under threat from climate change and other environmental factors.","The Great Barrier Reef is the largest coral reef system in the world."
"The International Space Station (ISS) is a habitable artificial satellite that orbits the Earth. It is a joint project between five space agencies, including NASA, Roscosmos, and the European Space Agency. The ISS is used for scientific research, space exploration, and international cooperation.","The International Space Station (ISS) is a habitable artificial satellite that orbits the Earth."
"The African elephant is the largest land animal in the world, weighing up to 6,000 kilograms and standing over three meters tall. It is found in 37 countries in sub-Saharan Africa and is known for its distinctive trunk and large, floppy ears. The elephant is under threat from habitat loss and poaching.","The African elephant is the largest land animal in the world."
"The Eiffel Tower is an iconic landmark in Paris, France, and one of the most recognizable structures in the world. It was built for the 1889 World's Fair and stands over 300 meters tall. The tower is visited by millions of tourists every year.","The Eiffel Tower is an iconic landmark in Paris, France."
